{
  "schema_version": "1.0.0",
  "campaign_id": "system_recalibration_001",
  "phase_id": "WM-01",
  "phase_run_id": "WM01-RUN-20260821",
  "status": "IN_PROGRESS",
  "operator_ids": ["Christopher_Robertson", "Codex_orchestration"],
  "start_utc": "2026-08-21T16:09:01.126Z",
  "end_utc": null,
  "configuration_id": "WM01-OPEN-DEFERRED-REPLACEMENT-SPECTROMETER-PENDING",
  "repository": {
    "path": "C:/Users/Chris/Documents/GitHub/Control_System",
    "branch": "main",
    "dirty_files": [
      "calibration/system_recalibration_001/README.md",
      "calibration/system_recalibration_001/analysis/calibration_matrix.csv",
      "calibration/system_recalibration_001/analysis/deferred_dependency_register_20260825.csv",
      "calibration/system_recalibration_001/analysis/gap_analysis.md",
      "calibration/system_recalibration_001/plans/campaign_sequence.md",
      "calibration/system_recalibration_001/readbacks/WM-01/",
      "docs/WaveMaster/WaveMaster_Front_Panel.jpg",
      "docs/WaveMaster/WaveMaster_Probe.jpg",
      "docs/WaveMaster/WaveMaster_Serial.jpg",
      "docs/experiment_requirement_campaign_crosswalk.md",
      "docs/opo_540_optical_configuration.md",
      "hardware_configuration.yaml"
    ]
  },
  "device_ids": ["WAVEMASTER-W0339", "WAVELENGTH-SPECTROMETER-REPLACEMENT-PENDING"],
  "component_ids": ["WAVEMASTER-PROBE-EXISTING"],
  "sample_ids": ["NO-SAMPLE-WM01"],
  "calibration_bundle_ids": ["CAL-system_recalibration_001-OM01-v1"],
  "artifact_index": "artifacts.csv",
  "acquisition_index": "acquisition_index.csv",
  "conditions_table": "conditions.csv",
  "measurements_table": "measurements.csv",
  "exclusions_table": "exclusions.csv",
  "calibration_links_table": "calibration_links.csv",
  "criterion_versions": {
    "measurement_contract": "1.1.0",
    "wm01_plan": "campaign_sequence_20260825_dependency_amendment"
  },
  "deviations": [
    "Rear-panel and cable/adapter photographs were removed as mandatory deliverables by direct operator authorization.",
    "An unplanned MIRcat red-source diagnostic is retained as rejected evidence.",
    "The installed WaveMaster failed optical qualification and WM-01 is deferred pending a replacement spectrometer."
  ],
  "user_input_required": [
    "Replacement spectrometer identity, calibration basis, interface, and delivery/installation date.",
    "Final hardware state after the last 2026-08-21 emission diagnostic."
  ],
  "restoration_artifact_id": null,
  "promotion_performed": false,
  "promotion_approval_reference": null,
  "notes": "Open deferred phase; no wavelength-metrology bundle issued. Independent phases may proceed only under the 2026-08-25 dependency amendment and separate authorization."
}
