{
  "schema_version": "1.0.0",
  "campaign_id": "system_recalibration_001",
  "phase_id": "PT-01",
  "phase_run_id": "system_recalibration_001_PT-01_001",
  "status": "PASS",
  "operator_ids": ["Christopher_Robertson"],
  "start_utc": "2026-08-13T22:29:35Z",
  "end_utc": "2026-08-17T17:17:03.671575Z",
  "configuration_id": "PT01-STEP8-FIRE-TO-MIRCAT-PIN4-v1",
  "repository": {
    "path": "C:/Users/Chris/Documents/GitHub/Control_System",
    "branch": "main",
    "dirty_files": [
      "campaigns/instrument_readiness_001/procedures/calibration/legacy_campaign_readme.md",
      "campaigns/instrument_readiness_001/planning/calibration/calibration_matrix.csv",
      "campaigns/instrument_readiness_001/planning/calibration/expansion_gap_map.md",
      "campaigns/instrument_readiness_001/planning/calibration/gap_analysis.md",
      "campaigns/instrument_readiness_001/procedures/calibration/legacy_sequence.md",
      "campaigns/instrument_readiness_001/procedures/characterization/legacy_campaign_readme.md",
      "campaigns/instrument_readiness_001/planning/characterization/characterization_matrix.csv",
      "campaigns/instrument_readiness_001/procedures/characterization/legacy_sequence.md",
      "campaigns/instrument_readiness_001/phases/SV-02B/requirement_brief.md",
      "campaigns/instrument_readiness_001/planning/experiment_requirement_campaign_crosswalk.md",
      "campaigns/experiment_campaigns.md",
      "campaigns/hrp_001/requirements.md",
      "campaigns/mbco_cryo_001/requirements.md"
    ]
  },
  "device_ids": ["T660-1-00369", "T660-2-00431", "PICOSCOPE-10261"],
  "component_ids": ["NDYAG-DB9-BNC-01", "MIRCAT-DB9-BOARD-01", "MIRCAT-DB9-CABLE-01", "ADAPTER-A", "ADAPTER-B"],
  "sample_ids": [],
  "calibration_bundle_ids": ["MS02-COMPLETED-WORKING-EVIDENCE", "T1-01-COMPLETED-WORKING-EVIDENCE"],
  "artifact_index": "artifacts.csv",
  "acquisition_index": "acquisition_index.csv",
  "conditions_table": "conditions.csv",
  "measurements_table": "measurements.csv",
  "exclusions_table": "exclusions.csv",
  "calibration_links_table": "calibration_links.csv",
  "criterion_versions": {"analysis": "PT01-ANALYSIS-v1", "acceptance": "PT01-ACCEPT-v1"},
  "deviations": ["DEV-PT01-001"],
  "user_input_required": [],
  "restoration_artifact_id": "PT01-RESTORATION-001",
  "promotion_performed": false,
  "promotion_approval_reference": null,
  "notes": "Non-emitting electrical phase. Initial preflight was not repeated. MC-01 was not started."
}
